[0;34m=== Duobingo API Test Suite ===[0m

[0;32mRunning all tests...[0m
============================= test session starts ==============================
platform linux -- Python 3.11.0rc1, pytest-7.4.4, pluggy-1.6.0 -- /home/mafoin/Documents/projet/M2-PROJET-BACK-PROTO/.venv/bin/python3.11
cachedir: .pytest_cache
rootdir: /home/mafoin/Documents/projet/M2-PROJET-BACK-PROTO
configfile: pytest.ini
plugins: cov-4.1.0, anyio-4.12.1, Faker-22.0.0, asyncio-0.21.1
asyncio: mode=Mode.STRICT
collecting ... collected 303 items

tests/test_auth.py::test_login_valid_credentials PASSED                  [  0%]
tests/test_auth.py::test_login_invalid_password PASSED                   [  0%]
tests/test_auth.py::test_login_user_not_found PASSED                     [  0%]
tests/test_auth.py::test_login_missing_email PASSED                      [  1%]
tests/test_auth.py::test_login_missing_password PASSED                   [  1%]
tests/test_auth.py::test_login_invalid_email_format PASSED               [  1%]
tests/test_auth.py::test_login_empty_credentials PASSED                  [  2%]
tests/test_auth.py::test_register_student_success PASSED                 [  2%]
tests/test_auth.py::test_register_duplicate_email PASSED                 [  2%]
tests/test_auth.py::test_register_invalid_password_too_short PASSED      [  3%]
tests/test_auth.py::test_register_invalid_level PASSED                   [  3%]
tests/test_auth.py::test_register_missing_required_fields PASSED         [  3%]
tests/test_auth.py::test_register_valid_levels PASSED                    [  4%]
tests/test_auth.py::test_get_user_profile_authenticated PASSED           [  4%]
tests/test_auth.py::test_get_user_profile_no_token PASSED                [  4%]
tests/test_auth.py::test_get_user_profile_invalid_token PASSED           [  5%]
tests/test_auth.py::test_get_user_profile_expired_token PASSED           [  5%]
tests/test_auth.py::test_get_user_profile_malformed_auth_header PASSED   [  5%]
tests/test_auth.py::test_get_professor_profile PASSED                    [  6%]
tests/test_auth.py::test_get_admin_profile PASSED                        [  6%]
tests/test_auth.py::test_update_user_email PASSED                        [  6%]
tests/test_auth.py::test_update_user_invalid_email PASSED                [  7%]
tests/test_auth.py::test_update_user_profile_unauthorized PASSED         [  7%]
tests/test_auth.py::test_update_user_email_already_exists PASSED         [  7%]
tests/test_auth.py::test_create_teacher_as_admin PASSED                  [  8%]
tests/test_auth.py::test_create_teacher_as_student PASSED                [  8%]
tests/test_auth.py::test_create_teacher_as_professor PASSED              [  8%]
tests/test_auth.py::test_create_user_invalid_role PASSED                 [  9%]
tests/test_auth.py::test_create_admin_as_admin PASSED                    [  9%]
tests/test_auth.py::test_create_user_no_auth PASSED                      [  9%]
tests/test_classrooms.py::test_list_classrooms_student PASSED            [ 10%]
tests/test_classrooms.py::test_list_classrooms_professor PASSED          [ 10%]
tests/test_classrooms.py::test_list_classrooms_admin PASSED              [ 10%]
tests/test_classrooms.py::test_list_classrooms_no_auth PASSED            [ 11%]
tests/test_classrooms.py::test_list_classrooms_pagination PASSED         [ 11%]
tests/test_classrooms.py::test_create_classroom_success PASSED           [ 11%]
tests/test_classrooms.py::test_create_classroom_as_student PASSED        [ 12%]
tests/test_classrooms.py::test_create_classroom_invalid_level PASSED     [ 12%]
tests/test_classrooms.py::test_create_classroom_missing_name PASSED      [ 12%]
tests/test_classrooms.py::test_create_classroom_no_auth PASSED           [ 13%]
tests/test_classrooms.py::test_get_classroom_as_member PASSED            [ 13%]
tests/test_classrooms.py::test_get_classroom_as_non_member PASSED        [ 13%]
tests/test_classrooms.py::test_get_classroom_not_found PASSED            [ 14%]
tests/test_classrooms.py::test_get_classroom_no_auth PASSED              [ 14%]
tests/test_classrooms.py::test_patch_classroom_as_responsible PASSED     [ 14%]
tests/test_classrooms.py::test_patch_classroom_as_secondary_prof PASSED  [ 15%]
tests/test_classrooms.py::test_patch_classroom_as_student PASSED         [ 15%]
tests/test_classrooms.py::test_patch_classroom_not_found PASSED          [ 15%]
tests/test_classrooms.py::test_delete_classroom_cascade PASSED           [ 16%]
tests/test_classrooms.py::test_delete_classroom_as_secondary_prof PASSED [ 16%]
tests/test_classrooms.py::test_delete_classroom_as_student PASSED        [ 16%]
tests/test_classrooms.py::test_delete_classroom_not_found PASSED         [ 17%]
tests/test_classrooms.py::test_get_classroom_members PASSED              [ 17%]
tests/test_classrooms.py::test_get_classroom_members_as_student PASSED   [ 17%]
tests/test_classrooms.py::test_get_classroom_members_pagination PASSED   [ 18%]
tests/test_classrooms.py::test_add_teacher_success PASSED                [ 18%]
tests/test_classrooms.py::test_add_teacher_invalid_email PASSED          [ 18%]
tests/test_classrooms.py::test_add_teacher_as_secondary_prof PASSED      [ 19%]
tests/test_classrooms.py::test_add_teacher_as_student PASSED             [ 19%]
tests/test_classrooms.py::test_remove_teacher_success PASSED             [ 19%]
tests/test_classrooms.py::test_remove_teacher_as_secondary_prof PASSED   [ 20%]
tests/test_classrooms.py::test_remove_teacher_not_found PASSED           [ 20%]
tests/test_classrooms.py::test_enroll_student_success PASSED             [ 20%]
tests/test_classrooms.py::test_enroll_student_already_enrolled PASSED    [ 21%]
tests/test_classrooms.py::test_enroll_student_invalid_email PASSED       [ 21%]
tests/test_classrooms.py::test_remove_student_success PASSED             [ 21%]
tests/test_classrooms.py::test_remove_student_as_secondary_prof PASSED   [ 22%]
tests/test_classrooms.py::test_remove_student_not_found PASSED           [ 22%]
tests/test_classrooms.py::test_join_classroom_valid_code PASSED          [ 22%]
tests/test_classrooms.py::test_join_classroom_invalid_code PASSED        [ 23%]
tests/test_classrooms.py::test_join_classroom_already_enrolled PASSED    [ 23%]
tests/test_classrooms.py::test_join_classroom_as_professor PASSED        [ 23%]
tests/test_classrooms.py::test_join_classroom_no_auth PASSED             [ 24%]
tests/test_classrooms.py::test_regenerate_code_success PASSED            [ 24%]
tests/test_classrooms.py::test_regenerate_code_as_secondary_prof PASSED  [ 24%]
tests/test_classrooms.py::test_regenerate_code_as_student PASSED         [ 25%]
tests/test_classrooms.py::test_regenerate_code_old_code_invalidated PASSED [ 25%]
tests/test_leitner.py::test_get_leitner_status PASSED                    [ 25%]
tests/test_leitner.py::test_leitner_status_distribution PASSED           [ 26%]
tests/test_leitner.py::test_leitner_status_no_questions PASSED           [ 26%]
tests/test_leitner.py::test_leitner_status_not_classroom_member PASSED   [ 26%]
tests/test_leitner.py::test_leitner_status_no_auth PASSED                [ 27%]
tests/test_leitner.py::test_start_leitner_session_10_questions PASSED    [ 27%]
tests/test_leitner.py::test_start_leitner_session_5_questions PASSED     [ 27%]
tests/test_leitner.py::test_start_leitner_session_15_questions PASSED    [ 28%]
tests/test_leitner.py::test_start_leitner_session_20_questions PASSED    [ 28%]
tests/test_leitner.py::test_start_leitner_session_invalid_count PASSED   [ 28%]
tests/test_leitner.py::test_start_leitner_no_questions_available PASSED  [ 29%]
tests/test_leitner.py::test_start_leitner_insufficient_questions PASSED  [ 29%]
tests/test_leitner.py::test_start_leitner_not_a_student PASSED           [ 29%]
tests/test_leitner.py::test_start_leitner_no_auth PASSED                 [ 30%]
tests/test_leitner.py::test_leitner_submit_correct_answer PASSED         [ 30%]
tests/test_leitner.py::test_leitner_submit_incorrect_answer PASSED       [ 30%]
tests/test_leitner.py::test_leitner_submit_session_not_found PASSED      [ 31%]
tests/test_leitner.py::test_leitner_submit_already_finished PASSED       [ 31%]
tests/test_leitner.py::test_finish_leitner_session PASSED                [ 31%]
tests/test_leitner.py::test_leitner_promotion_rules PASSED               [ 32%]
tests/test_leitner.py::test_leitner_demotion_to_box_1 PASSED             [ 32%]
tests/test_leitner.py::test_finish_leitner_new_box_distribution PASSED   [ 32%]
tests/test_leitner.py::test_finish_leitner_accuracy_calculation PASSED   [ 33%]
tests/test_leitner.py::test_finish_leitner_not_found PASSED              [ 33%]
tests/test_leitner.py::test_finish_leitner_already_finished PASSED       [ 33%]
tests/test_leitner.py::test_leitner_review_after_finish PASSED           [ 33%]
tests/test_leitner.py::test_leitner_review_shows_box_movements PASSED    [ 34%]
tests/test_leitner.py::test_leitner_review_includes_explanations PASSED  [ 34%]
tests/test_leitner.py::test_leitner_review_summary_stats PASSED          [ 34%]
tests/test_leitner.py::test_leitner_review_before_finish PASSED          [ 35%]
tests/test_leitner.py::test_leitner_review_not_found PASSED              [ 35%]
tests/test_leitner.py::test_leitner_review_wrong_student PASSED          [ 35%]
tests/test_leitner.py::test_leitner_question_distribution_follows_rules PASSED [ 36%]
tests/test_leitner.py::test_leitner_box_5_stays_on_correct PASSED        [ 36%]
tests/test_leitner.py::test_leitner_box_1_on_incorrect PASSED            [ 36%]
tests/test_media.py::test_upload_image_success_jpg PASSED                [ 37%]
tests/test_media.py::test_upload_image_success_png PASSED                [ 37%]
tests/test_media.py::test_upload_invalid_file_type PASSED                [ 37%]
tests/test_media.py::test_upload_file_too_large PASSED                   [ 38%]
tests/test_media.py::test_upload_no_file PASSED                          [ 38%]
tests/test_media.py::test_upload_as_student PASSED                       [ 38%]
tests/test_media.py::test_upload_as_secondary_prof PASSED                [ 39%]
tests/test_media.py::test_upload_no_auth PASSED                          [ 39%]
tests/test_media.py::test_upload_invalid_image_format PASSED             [ 39%]
tests/test_media.py::test_list_media PASSED                              [ 40%]
tests/test_media.py::test_list_media_pagination PASSED                   [ 40%]
tests/test_media.py::test_list_media_filtered_by_user PASSED             [ 40%]
tests/test_media.py::test_list_media_as_student PASSED                   [ 41%]
tests/test_media.py::test_list_media_no_auth PASSED                      [ 41%]
tests/test_media.py::test_get_media_success PASSED                       [ 41%]
tests/test_media.py::test_get_media_not_found PASSED                     [ 42%]
tests/test_media.py::test_get_media_no_auth PASSED                       [ 42%]
tests/test_media.py::test_delete_unused_media PASSED                     [ 42%]
tests/test_media.py::test_delete_used_media PASSED                       [ 43%]
tests/test_media.py::test_delete_media_not_owner PASSED                  [ 43%]
tests/test_media.py::test_delete_media_as_student PASSED                 [ 43%]
tests/test_media.py::test_delete_media_not_found PASSED                  [ 44%]
tests/test_media.py::test_delete_media_no_auth PASSED                    [ 44%]
tests/test_media.py::test_list_orphaned_media_as_admin PASSED            [ 44%]
tests/test_media.py::test_list_orphaned_media_as_professor PASSED        [ 45%]
tests/test_media.py::test_list_orphaned_media_as_student PASSED          [ 45%]
tests/test_media.py::test_list_orphaned_media_no_auth PASSED             [ 45%]
tests/test_media.py::test_media_url_is_accessible PASSED                 [ 46%]
tests/test_media.py::test_media_content_type_validation PASSED           [ 46%]
tests/test_media.py::test_media_filename_sanitization PASSED             [ 46%]
tests/test_media.py::test_bulk_delete_orphaned_media PASSED              [ 47%]
tests/test_media.py::test_media_association_with_question PASSED         [ 47%]
tests/test_modules.py::test_list_modules PASSED                          [ 47%]
tests/test_modules.py::test_list_modules_pagination PASSED               [ 48%]
tests/test_modules.py::test_list_modules_as_non_member PASSED            [ 48%]
tests/test_modules.py::test_list_modules_no_auth PASSED                  [ 48%]
tests/test_modules.py::test_create_module_success PASSED                 [ 49%]
tests/test_modules.py::test_create_module_with_prerequisite PASSED       [ 49%]
tests/test_modules.py::test_create_module_circular_prerequisite PASSED   [ 49%]
tests/test_modules.py::test_create_module_as_student PASSED              [ 50%]
tests/test_modules.py::test_create_module_missing_name PASSED            [ 50%]
tests/test_modules.py::test_create_module_as_secondary_prof PASSED       [ 50%]
tests/test_modules.py::test_get_module_success PASSED                    [ 51%]
tests/test_modules.py::test_get_module_locked_for_student PASSED         [ 51%]
tests/test_modules.py::test_get_module_unlocked_after_prerequisite PASSED [ 51%]
tests/test_modules.py::test_get_module_not_found PASSED                  [ 52%]
tests/test_modules.py::test_get_module_no_auth PASSED                    [ 52%]
tests/test_modules.py::test_update_module_success PASSED                 [ 52%]
tests/test_modules.py::test_update_module_as_secondary_prof PASSED       [ 53%]
tests/test_modules.py::test_update_module_as_student PASSED              [ 53%]
tests/test_modules.py::test_update_module_not_found PASSED               [ 53%]
tests/test_modules.py::test_update_module_prerequisite_circular PASSED   [ 54%]
tests/test_modules.py::test_delete_module_cascade PASSED                 [ 54%]
tests/test_modules.py::test_delete_module_as_secondary_prof PASSED       [ 54%]
tests/test_modules.py::test_delete_module_as_student PASSED              [ 55%]
tests/test_modules.py::test_delete_module_not_found PASSED               [ 55%]
tests/test_modules.py::test_delete_module_with_dependent_modules PASSED  [ 55%]
tests/test_questions.py::test_create_qcm_question PASSED                 [ 56%]
tests/test_questions.py::test_create_qcm_multiple_correct_answers PASSED [ 56%]
tests/test_questions.py::test_create_qcm_missing_options PASSED          [ 56%]
tests/test_questions.py::test_create_qcm_no_correct_answer PASSED        [ 57%]
tests/test_questions.py::test_create_truefalse_question PASSED           [ 57%]
tests/test_questions.py::test_create_truefalse_with_wrong_options PASSED [ 57%]
tests/test_questions.py::test_create_matching_question PASSED            [ 58%]
tests/test_questions.py::test_create_matching_missing_pairs PASSED       [ 58%]
tests/test_questions.py::test_create_matching_insufficient_pairs PASSED  [ 58%]
tests/test_questions.py::test_create_text_question PASSED                [ 59%]
tests/test_questions.py::test_create_text_case_sensitive PASSED          [ 59%]
tests/test_questions.py::test_create_text_missing_config PASSED          [ 59%]
tests/test_questions.py::test_create_text_missing_accepted_answer PASSED [ 60%]
tests/test_questions.py::test_create_image_question PASSED               [ 60%]
tests/test_questions.py::test_create_image_missing_media PASSED          [ 60%]
tests/test_questions.py::test_create_image_missing_zones PASSED          [ 61%]
tests/test_questions.py::test_create_image_invalid_media_id PASSED       [ 61%]
tests/test_questions.py::test_list_questions PASSED                      [ 61%]
tests/test_questions.py::test_list_questions_student_hides_answers PASSED [ 62%]
tests/test_questions.py::test_get_question PASSED                        [ 62%]
tests/test_questions.py::test_get_question_not_found PASSED              [ 62%]
tests/test_questions.py::test_update_question PASSED                     [ 63%]
tests/test_questions.py::test_update_question_as_student PASSED          [ 63%]
tests/test_questions.py::test_update_question_not_found PASSED           [ 63%]
tests/test_questions.py::test_delete_question_removes_from_leitner PASSED [ 64%]
tests/test_questions.py::test_delete_question_as_student PASSED          [ 64%]
tests/test_questions.py::test_delete_question_not_found PASSED           [ 64%]
tests/test_questions.py::test_create_question_as_student PASSED          [ 65%]
tests/test_questions.py::test_create_question_invalid_type PASSED        [ 65%]
tests/test_questions.py::test_create_question_no_auth PASSED             [ 65%]
tests/test_questions.py::test_question_visibility_in_session PASSED      [ 66%]
tests/test_quizzes.py::test_list_quizzes PASSED                          [ 66%]
tests/test_quizzes.py::test_list_quizzes_pagination PASSED               [ 66%]
tests/test_quizzes.py::test_list_quizzes_shows_locked_status PASSED      [ 66%]
tests/test_quizzes.py::test_list_quizzes_no_auth PASSED                  [ 67%]
tests/test_quizzes.py::test_create_quiz_success PASSED                   [ 67%]
tests/test_quizzes.py::test_create_quiz_with_prerequisite PASSED         [ 67%]
tests/test_quizzes.py::test_create_quiz_circular_prerequisite PASSED     [ 68%]
tests/test_quizzes.py::test_create_quiz_as_secondary_prof PASSED         [ 68%]
tests/test_quizzes.py::test_create_quiz_as_student PASSED                [ 68%]
tests/test_quizzes.py::test_create_quiz_missing_title PASSED             [ 69%]
tests/test_quizzes.py::test_create_quiz_invalid_min_score PASSED         [ 69%]
tests/test_quizzes.py::test_get_quiz_success PASSED                      [ 69%]
tests/test_quizzes.py::test_quiz_locked_prerequisite_not_met PASSED      [ 70%]
tests/test_quizzes.py::test_quiz_unlocked_after_prerequisite PASSED      [ 70%]
tests/test_quizzes.py::test_get_quiz_not_found PASSED                    [ 70%]
tests/test_quizzes.py::test_get_quiz_no_auth PASSED                      [ 71%]
tests/test_quizzes.py::test_update_quiz_success PASSED                   [ 71%]
tests/test_quizzes.py::test_update_quiz_activate_deactivate PASSED       [ 71%]
tests/test_quizzes.py::test_update_quiz_as_secondary_prof PASSED         [ 72%]
tests/test_quizzes.py::test_update_quiz_as_student PASSED                [ 72%]
tests/test_quizzes.py::test_update_quiz_not_found PASSED                 [ 72%]
tests/test_quizzes.py::test_delete_quiz_cascade PASSED                   [ 73%]
tests/test_quizzes.py::test_delete_quiz_as_secondary_prof PASSED         [ 73%]
tests/test_quizzes.py::test_delete_quiz_as_student PASSED                [ 73%]
tests/test_quizzes.py::test_delete_quiz_not_found PASSED                 [ 74%]
tests/test_quizzes.py::test_delete_quiz_with_dependent_quizzes PASSED    [ 74%]
tests/test_quizzes.py::test_inactive_quiz_visibility PASSED              [ 74%]
tests/test_quizzes.py::test_quiz_question_count_updated PASSED           [ 75%]
tests/test_sessions.py::test_start_session_success PASSED                [ 75%]
tests/test_sessions.py::test_start_session_locked_quiz PASSED            [ 75%]
tests/test_sessions.py::test_start_session_inactive_quiz PASSED          [ 76%]
tests/test_sessions.py::test_start_session_not_a_student PASSED          [ 76%]
tests/test_sessions.py::test_start_session_quiz_not_found PASSED         [ 76%]
tests/test_sessions.py::test_start_session_no_auth PASSED                [ 77%]
tests/test_sessions.py::test_start_session_not_classroom_member PASSED   [ 77%]
tests/test_sessions.py::test_submit_answer_qcm_correct PASSED            [ 77%]
tests/test_sessions.py::test_submit_answer_qcm_incorrect PASSED          [ 78%]
tests/test_sessions.py::test_submit_answer_qcm_multiple_selections PASSED [ 78%]
tests/test_sessions.py::test_submit_answer_text_exact_match PASSED       [ 78%]
tests/test_sessions.py::test_submit_answer_text_with_typo PASSED         [ 79%]
tests/test_sessions.py::test_submit_answer_text_case_insensitive PASSED  [ 79%]
tests/test_sessions.py::test_submit_answer_text_case_sensitive PASSED    [ 79%]
tests/test_sessions.py::test_submit_answer_image_click_in_zone PASSED    [ 80%]
tests/test_sessions.py::test_submit_answer_image_click_outside_zone PASSED [ 80%]
tests/test_sessions.py::test_submit_answer_matching_correct PASSED       [ 80%]
tests/test_sessions.py::test_submit_answer_matching_incorrect PASSED     [ 81%]
tests/test_sessions.py::test_submit_answer_matching_partial PASSED       [ 81%]
tests/test_sessions.py::test_submit_answer_session_not_found PASSED      [ 81%]
tests/test_sessions.py::test_submit_answer_session_already_finished PASSED [ 82%]
tests/test_sessions.py::test_submit_answer_question_not_in_session PASSED [ 82%]
tests/test_sessions.py::test_submit_answer_duplicate PASSED              [ 82%]
tests/test_sessions.py::test_finish_session_with_passing_score PASSED    [ 83%]
tests/test_sessions.py::test_finish_session_with_failing_score PASSED    [ 83%]
tests/test_sessions.py::test_finish_session_unlock_next_module PASSED    [ 83%]
tests/test_sessions.py::test_finish_session_unlocks_next_quiz PASSED     [ 84%]
tests/test_sessions.py::test_finish_session_adds_to_leitner_box_1 PASSED [ 84%]
tests/test_sessions.py::test_finish_session_not_found PASSED             [ 84%]
tests/test_sessions.py::test_finish_session_already_finished PASSED      [ 85%]
tests/test_sessions.py::test_review_session_before_finish PASSED         [ 85%]
tests/test_sessions.py::test_review_session_after_finish PASSED          [ 85%]
tests/test_sessions.py::test_review_session_contains_explanations PASSED [ 86%]
tests/test_sessions.py::test_review_session_shows_student_answers PASSED [ 86%]
tests/test_sessions.py::test_review_session_not_found PASSED             [ 86%]
tests/test_sessions.py::test_review_session_wrong_student PASSED         [ 87%]
tests/test_stats.py::test_student_stats_complete PASSED                  [ 87%]
tests/test_stats.py::test_student_stats_with_no_progress PASSED          [ 87%]
tests/test_stats.py::test_student_stats_leitner_mastery_calculation PASSED [ 88%]
tests/test_stats.py::test_student_stats_classrooms_progress PASSED       [ 88%]
tests/test_stats.py::test_student_stats_no_auth PASSED                   [ 88%]
tests/test_stats.py::test_student_stats_as_professor PASSED              [ 89%]
tests/test_stats.py::test_leaderboard_ranking PASSED                     [ 89%]
tests/test_stats.py::test_leaderboard_includes_rank PASSED               [ 89%]
tests/test_stats.py::test_leaderboard_includes_leitner_mastery PASSED    [ 90%]
tests/test_stats.py::test_leaderboard_pagination PASSED                  [ 90%]
tests/test_stats.py::test_leaderboard_not_member PASSED                  [ 90%]
tests/test_stats.py::test_leaderboard_no_auth PASSED                     [ 91%]
tests/test_stats.py::test_leaderboard_not_found PASSED                   [ 91%]
tests/test_stats.py::test_professor_dashboard PASSED                     [ 91%]
tests/test_stats.py::test_dashboard_modules_stats PASSED                 [ 92%]
tests/test_stats.py::test_dashboard_hardest_questions PASSED             [ 92%]
tests/test_stats.py::test_dashboard_alert_students PASSED                [ 92%]
tests/test_stats.py::test_dashboard_leitner_stats PASSED                 [ 93%]
tests/test_stats.py::test_dashboard_non_professor PASSED                 [ 93%]
tests/test_stats.py::test_dashboard_secondary_prof PASSED                [ 93%]
tests/test_stats.py::test_dashboard_no_auth PASSED                       [ 94%]
tests/test_stats.py::test_module_progress PASSED                         [ 94%]
tests/test_stats.py::test_module_progress_completion_rate PASSED         [ 94%]
tests/test_stats.py::test_module_progress_not_found PASSED               [ 95%]
tests/test_stats.py::test_module_progress_no_auth PASSED                 [ 95%]
tests/test_stats.py::test_quiz_progress PASSED                           [ 95%]
tests/test_stats.py::test_quiz_progress_best_score PASSED                [ 96%]
tests/test_stats.py::test_quiz_progress_attempts_count PASSED            [ 96%]
tests/test_stats.py::test_quiz_progress_not_found PASSED                 [ 96%]
tests/test_stats.py::test_classroom_progress PASSED                      [ 97%]
tests/test_stats.py::test_classroom_progress_all_modules PASSED          [ 97%]
tests/test_stats.py::test_classroom_progress_not_member PASSED           [ 97%]
tests/test_stats.py::test_classroom_progress_no_auth PASSED              [ 98%]
tests/test_stats.py::test_student_progress_view_professor PASSED         [ 98%]
tests/test_stats.py::test_student_progress_view_secondary_prof PASSED    [ 98%]
tests/test_stats.py::test_student_progress_view_unauthorized PASSED      [ 99%]
tests/test_stats.py::test_student_progress_view_self PASSED              [ 99%]
tests/test_stats.py::test_student_progress_student_not_found PASSED      [ 99%]
tests/test_stats.py::test_student_progress_classroom_not_found PASSED    [100%]

=============================== warnings summary ===============================
.venv/lib/python3.11/site-packages/pydantic/_internal/_config.py:271
  /home/mafoin/Documents/projet/M2-PROJET-BACK-PROTO/.venv/lib/python3.11/site-packages/pydantic/_internal/_config.py:271: PydanticDeprecatedSince20: Support for class-based `config` is deprecated, use ConfigDict instead. Deprecated in Pydantic V2.0 to be removed in V3.0. See Pydantic V2 Migration Guide at https://errors.pydantic.dev/2.5/migration/
    warnings.warn(DEPRECATION_MESSAGE, DeprecationWarning)

.venv/lib/python3.11/site-packages/passlib/utils/__init__.py:854
  /home/mafoin/Documents/projet/M2-PROJET-BACK-PROTO/.venv/lib/python3.11/site-packages/passlib/utils/__init__.py:854: DeprecationWarning: 'crypt' is deprecated and slated for removal in Python 3.13
    from crypt import crypt as _crypt

tests/test_auth.py::test_login_valid_credentials
  /home/mafoin/Documents/projet/M2-PROJET-BACK-PROTO/tests/conftest.py:114: DeprecationWarning: There is no current event loop
    asyncio.get_event_loop().run_until_complete(create_tables())

tests/test_auth.py::test_login_valid_credentials
  /home/mafoin/Documents/projet/M2-PROJET-BACK-PROTO/tests/conftest.py:452: DeprecationWarning: There is no current event loop
    asyncio.get_event_loop().run_until_complete(_seed())

tests/test_leitner.py::test_leitner_submit_correct_answer
tests/test_leitner.py::test_leitner_submit_incorrect_answer
tests/test_leitner.py::test_finish_leitner_session
tests/test_leitner.py::test_leitner_promotion_rules
tests/test_leitner.py::test_leitner_demotion_to_box_1
tests/test_leitner.py::test_finish_leitner_new_box_distribution
tests/test_leitner.py::test_finish_leitner_accuracy_calculation
tests/test_leitner.py::test_leitner_review_before_finish
  /home/mafoin/Documents/projet/M2-PROJET-BACK-PROTO/tests/conftest.py:1353: DeprecationWarning: There is no current event loop
    asyncio.get_event_loop().run_until_complete(_seed_leitner())

tests/test_leitner.py: 2 warnings
tests/test_questions.py: 6 warnings
tests/test_sessions.py: 19 warnings
  /home/mafoin/Documents/projet/M2-PROJET-BACK-PROTO/tests/conftest.py:1083: DeprecationWarning: There is no current event loop
    asyncio.get_event_loop().run_until_complete(_seed_questions())

tests/test_questions.py: 1 warning
tests/test_sessions.py: 19 warnings
  /home/mafoin/Documents/projet/M2-PROJET-BACK-PROTO/tests/conftest.py:1196: DeprecationWarning: There is no current event loop
    asyncio.get_event_loop().run_until_complete(_seed_sessions())

tests/test_stats.py::test_student_progress_classroom_not_found
  /home/mafoin/Documents/projet/M2-PROJET-BACK-PROTO/tests/conftest.py:123: DeprecationWarning: There is no current event loop
    asyncio.get_event_loop().run_until_complete(drop_tables())

-- Docs: https://docs.pytest.org/en/stable/how-to/capture-warnings.html
================= 303 passed, 60 warnings in 151.61s (0:02:31) =================

[0;32mTests completed![0m
